{
  "title": "Added new property for reporting flag (Playwright Testing)",
  "owner": "mjmadhu",
  "startDate": "2026-02-04T08:38:51Z",
  "endDate": "2026-04-02T11:02:36Z",
  "specPR": {
    "repo": "Azure/azure-rest-api-specs",
    "number": 40148,
    "url": "https://github.com/Azure/azure-rest-api-specs/pull/40148",
    "title": "Added new property for reporting flag",
    "author": "mjmadhu",
    "createdAt": "2026-02-04T08:38:51Z",
    "mergedAt": "2026-02-11T17:45:03Z",
    "mergedBy": "mjmadhu",
    "state": "merged",
    "labels": [
      "ARMSignedOff",
      "Load Test Service",
      "ARMReview",
      "resource-manager",
      "RPaaS",
      "TypeSpec",
      "VersioningReviewRequired",
      "Versioning-Approved-BranchPolicyException",
      "PublishToCustomers",
      "ARMAutoSignedOff-IncrementalTSP"
    ],
    "reviewers": [
      "mitsha-microsoft",
      "kashish2508"
    ],
    "events": [
      {
        "type": "pr_created",
        "timestamp": "2026-02-04T08:38:51Z",
        "actor": "mjmadhu",
        "actorRole": "author",
        "description": "Opened spec PR for Playwright Testing reporting flag property",
        "sentiment": "neutral",
        "details": {
          "url": "https://github.com/Azure/azure-rest-api-specs/pull/40148"
        }
      },
      {
        "type": "bot_comment",
        "timestamp": "2026-02-04T08:39:14Z",
        "actor": "github-actions[bot]",
        "actorRole": "bot",
        "description": "CI bot posted Next Steps to Merge checklist",
        "sentiment": "neutral",
        "details": {
          "url": "https://github.com/Azure/azure-rest-api-specs/pull/40148#issuecomment-3846092870"
        }
      },
      {
        "type": "review_approved",
        "timestamp": "2026-02-04T08:40:19Z",
        "actor": "mitsha-microsoft",
        "actorRole": "reviewer",
        "description": "Approved by mitsha-microsoft",
        "sentiment": "positive",
        "details": {
          "url": "https://github.com/Azure/azure-rest-api-specs/pull/40148#pullrequestreview-3749699560",
          "reviewState": "APPROVED"
        }
      },
      {
        "type": "review_approved",
        "timestamp": "2026-02-04T08:42:28Z",
        "actor": "kashish2508",
        "actorRole": "reviewer",
        "description": "Approved by kashish2508",
        "sentiment": "positive",
        "details": {
          "url": "https://github.com/Azure/azure-rest-api-specs/pull/40148#pullrequestreview-3749707736",
          "reviewState": "APPROVED"
        }
      },
      {
        "type": "bot_comment",
        "timestamp": "2026-02-04T08:43:59Z",
        "actor": "github-actions[bot]",
        "actorRole": "bot",
        "description": "API Change Check \u2014 ApiView links generated for all languages",
        "sentiment": "neutral",
        "details": {
          "url": "https://github.com/Azure/azure-rest-api-specs/pull/40148#issuecomment-3846111141"
        }
      },
      {
        "type": "issue_comment",
        "timestamp": "2026-02-04T08:52:17Z",
        "actor": "mjmadhu",
        "actorRole": "author",
        "description": "Author noted this version was merged yesterday and not yet live to users",
        "sentiment": "neutral",
        "details": {
          "url": "https://github.com/Azure/azure-rest-api-specs/pull/40148#issuecomment-3846145562",
          "body": "This version was merged yesterday only and not yet live to the users."
        }
      },
      {
        "type": "idle_gap",
        "timestamp": "2026-02-04T08:52:17Z",
        "endTimestamp": "2026-02-11T17:45:03Z",
        "actor": "system",
        "actorRole": "bot",
        "description": "7-day wait after approval before merge \u2014 likely versioning review process",
        "sentiment": "blocking",
        "details": {
          "durationHours": 176.9
        }
      },
      {
        "type": "pr_merged",
        "timestamp": "2026-02-11T17:45:03Z",
        "actor": "mjmadhu",
        "actorRole": "author",
        "description": "Spec PR merged by mjmadhu",
        "sentiment": "positive",
        "details": {
          "url": "https://github.com/Azure/azure-rest-api-specs/pull/40148"
        }
      }
    ]
  },
  "sdkPRs": [
    {
      "repo": "Azure/azure-sdk-for-java",
      "language": "Java",
      "number": 48660,
      "url": "https://github.com/Azure/azure-sdk-for-java/pull/48660",
      "title": "[AutoPR azure-resourcemanager-playwright] SDK Generation",
      "author": "azure-sdk",
      "createdAt": "2026-04-01T10:24:50Z",
      "mergedAt": "2026-04-02T07:45:18Z",
      "mergedBy": "kashish2508",
      "state": "merged",
      "labels": [
        "Mgmt"
      ],
      "reviewers": [
        "ArthurMa1978",
        "haolingdong-msft",
        "XiaofeiCao",
        "weidongxu-microsoft",
        "kashish2508"
      ],
      "events": [
        {
          "type": "pr_created",
          "timestamp": "2026-04-01T10:24:50Z",
          "actor": "azure-sdk",
          "actorRole": "bot",
          "description": "Java SDK PR auto-generated by pipeline",
          "sentiment": "neutral",
          "details": {
            "url": "https://github.com/Azure/azure-sdk-for-java/pull/48660"
          }
        },
        {
          "type": "bot_comment",
          "timestamp": "2026-04-01T10:37:45Z",
          "actor": "github-actions[bot]",
          "actorRole": "bot",
          "description": "API Change Check \u2014 ApiView link generated for Java SDK",
          "sentiment": "neutral",
          "details": {
            "url": "https://github.com/Azure/azure-sdk-for-java/pull/48660#issuecomment-4169143056"
          }
        },
        {
          "type": "issue_comment",
          "timestamp": "2026-04-01T11:37:01Z",
          "actor": "kashish2508",
          "actorRole": "reviewer",
          "description": "kashish2508 ran /check-enforcer override to unblock CI",
          "sentiment": "neutral",
          "details": {
            "url": "https://github.com/Azure/azure-sdk-for-java/pull/48660#issuecomment-4169451693",
            "body": "/check-enforcer override"
          }
        },
        {
          "type": "review_comment",
          "timestamp": "2026-04-01T11:44:03Z",
          "actor": "copilot-pull-request-reviewer[bot]",
          "actorRole": "copilot",
          "description": "Copilot code review \u2014 generated 4 comments about Javadoc wording and punctuation",
          "sentiment": "neutral",
          "details": {
            "url": "https://github.com/Azure/azure-sdk-for-java/pull/48660#pullrequestreview-4043598212",
            "reviewState": "COMMENTED"
          }
        },
        {
          "type": "review_approved",
          "timestamp": "2026-04-02T02:32:15Z",
          "actor": "weidongxu-microsoft",
          "actorRole": "reviewer",
          "description": "weidongxu-microsoft approved",
          "sentiment": "positive",
          "details": {
            "url": "https://github.com/Azure/azure-sdk-for-java/pull/48660#pullrequestreview-4048014574",
            "reviewState": "APPROVED"
          }
        },
        {
          "type": "pr_merged",
          "timestamp": "2026-04-02T07:45:18Z",
          "actor": "kashish2508",
          "actorRole": "reviewer",
          "description": "Java SDK PR merged by kashish2508",
          "sentiment": "positive",
          "details": {
            "url": "https://github.com/Azure/azure-sdk-for-java/pull/48660"
          }
        }
      ]
    },
    {
      "repo": "Azure/azure-sdk-for-go",
      "language": "Go",
      "number": 26469,
      "url": "https://github.com/Azure/azure-sdk-for-go/pull/26469",
      "title": "[AutoPR armplaywright] SDK Generation",
      "author": "azure-sdk",
      "createdAt": "2026-04-01T10:21:46Z",
      "mergedAt": "2026-04-02T07:45:25Z",
      "mergedBy": "kashish2508",
      "state": "merged",
      "labels": [
        "Mgmt"
      ],
      "reviewers": [
        "lirenhe",
        "JiaqiZhang-Dev",
        "tadelesh",
        "kashish2508"
      ],
      "events": [
        {
          "type": "pr_created",
          "timestamp": "2026-04-01T10:21:46Z",
          "actor": "azure-sdk",
          "actorRole": "bot",
          "description": "Go SDK PR auto-generated by pipeline",
          "sentiment": "neutral",
          "details": {
            "url": "https://github.com/Azure/azure-sdk-for-go/pull/26469"
          }
        },
        {
          "type": "bot_comment",
          "timestamp": "2026-04-01T10:33:51Z",
          "actor": "github-actions[bot]",
          "actorRole": "bot",
          "description": "API Change Check \u2014 ApiView link generated for Go SDK",
          "sentiment": "neutral",
          "details": {
            "url": "https://github.com/Azure/azure-sdk-for-go/pull/26469#issuecomment-4169123681"
          }
        },
        {
          "type": "review_comment",
          "timestamp": "2026-04-01T11:42:14Z",
          "actor": "copilot-pull-request-reviewer[bot]",
          "actorRole": "copilot",
          "description": "Copilot code review \u2014 generated 2 comments about doc wording (boolean vs enum)",
          "sentiment": "neutral",
          "details": {
            "url": "https://github.com/Azure/azure-sdk-for-go/pull/26469#pullrequestreview-4043583160",
            "reviewState": "COMMENTED"
          }
        },
        {
          "type": "review_approved",
          "timestamp": "2026-04-02T02:06:26Z",
          "actor": "tadelesh",
          "actorRole": "reviewer",
          "description": "tadelesh approved (Go language owner)",
          "sentiment": "positive",
          "details": {
            "url": "https://github.com/Azure/azure-sdk-for-go/pull/26469#pullrequestreview-4047955478",
            "reviewState": "APPROVED"
          }
        },
        {
          "type": "pr_merged",
          "timestamp": "2026-04-02T07:45:25Z",
          "actor": "kashish2508",
          "actorRole": "reviewer",